[
  {
    "id": "cloudflare-tunnel",
    "repository_url": "https://github.com/diceframe/cloudflare-tunnel",
    "branch": "main",
    "author": "diceframe",
    "stars": 0,
    "release_tag": "v0.1.0",
    "release_url": "https://github.com/diceframe/cloudflare-tunnel/releases/tag/v0.1.0",
    "commit_sha": "ee2f65694bd77b9be62e47170a197d977636db79",
    "latest": {
      "version": "0.1.0",
      "release_tag": "v0.1.0",
      "release_url": "https://github.com/diceframe/cloudflare-tunnel/releases/tag/v0.1.0",
      "commit_sha": "ee2f65694bd77b9be62e47170a197d977636db79",
      "published_at": "2026-08-07T18:32:29Z",
      "requires_approval": false
    },
    "archive_url": "https://github.com/diceframe/cloudflare-tunnel/archive/ee2f65694bd77b9be62e47170a197d977636db79.zip",
    "distribution": "repository",
    "risk_level": "unrestricted-process",
    "update_policy": "notify",
    "approved_permissions": [
      "diceframe.http",
      "network.client",
      "plugin.data",
      "process.spawn",
      "tool.execute",
      "tunnel.publish"
    ],
    "permission_changes": [],
    "trust_level": "official",
    "installable": true,
    "verification_error": "",
    "manifest": {
      "schema_version": 1,
      "id": "cloudflare-tunnel",
      "name": "Cloudflare 快速隧道",
      "version": "0.1.0",
      "description": "一键生成公网 HTTPS 访问地址（trycloudflare.com，免账号免域名），把邀请链接/Bot 桥接对外可用。需 DiceFrame 1.9.12 及以上。",
      "plugin_type": "tool",
      "entrypoint": [
        "{python}",
        "{plugin_dir}/main.py"
      ],
      "config_schema": "config.schema.json",
      "permissions": [
        "tool.execute",
        "process.spawn",
        "network.client",
        "plugin.data",
        "diceframe.http",
        "tunnel.publish"
      ],
      "min_app_version": "1.9.12",
      "tool_ui": "tunnel-card",
      "docs": "README_CN.md"
    }
  },
  {
    "id": "frieren-journey",
    "repository_url": "https://github.com/EOEOY/frieren-journey",
    "branch": "master",
    "author": "EOEOY",
    "stars": 1,
    "release_tag": "v1.2.0",
    "release_url": "https://github.com/EOEOY/frieren-journey/releases/tag/v1.2.0",
    "commit_sha": "31a04e52e77f20521cd020f793edf6aecbef746e",
    "latest": {
      "version": "1.2.0",
      "release_tag": "v1.2.0",
      "release_url": "https://github.com/EOEOY/frieren-journey/releases/tag/v1.2.0",
      "commit_sha": "31a04e52e77f20521cd020f793edf6aecbef746e",
      "published_at": "2026-08-06T11:00:50Z",
      "requires_approval": false
    },
    "archive_url": "https://github.com/EOEOY/frieren-journey/archive/31a04e52e77f20521cd020f793edf6aecbef746e.zip",
    "distribution": "repository",
    "risk_level": "declarative",
    "update_policy": "automatic",
    "approved_permissions": [
      "content.import",
      "content.read",
      "plugin.config"
    ],
    "permission_changes": [],
    "trust_level": "community",
    "installable": true,
    "verification_error": "",
    "manifest": {
      "schema_version": 1,
      "id": "frieren-journey",
      "name": "葬送的芙莉莲·旅途",
      "version": "1.2.0",
      "description": "以《葬送的芙莉莲》为蓝本的完整奇幻冒险规则包：魔王战后的百年旅程、魔法使等级、人类魔法、魔力制限与魔族。启用后创建游戏即可选择本世界与规则。非官方同人，版权归原作所有。",
      "plugin_type": "content-pack",
      "config_schema": "config.schema.json",
      "capabilities": [
        "content.rule",
        "content.world",
        "content.character-template"
      ],
      "permissions": [
        "plugin.config",
        "content.read",
        "content.import"
      ],
      "contributes": {
        "rules": [
          "content/rules/*.json"
        ],
        "world_templates": [
          "content/worlds/*.json"
        ],
        "character_templates": [
          "content/characters/*.json"
        ],
        "npcs": [
          "content/npc/*.json"
        ],
        "items": [
          "content/items/*.json"
        ],
        "spells": [
          "content/spells/*.json"
        ],
        "classes": [
          "content/classes/*.json"
        ]
      },
      "docs": "README_CN.md"
    }
  },
  {
    "id": "hyouka",
    "repository_url": "https://github.com/EOEOY/hyouka",
    "branch": "main",
    "author": "EOEOY",
    "stars": 0,
    "release_tag": "v1.2.0",
    "release_url": "https://github.com/EOEOY/hyouka/releases/tag/v1.2.0",
    "commit_sha": "b95366b96ba88d2054833cc3c0192a6edb982b39",
    "latest": {
      "version": "1.2.0",
      "release_tag": "v1.2.0",
      "release_url": "https://github.com/EOEOY/hyouka/releases/tag/v1.2.0",
      "commit_sha": "b95366b96ba88d2054833cc3c0192a6edb982b39",
      "published_at": "2026-08-06T11:00:51Z",
      "requires_approval": false
    },
    "archive_url": "https://github.com/EOEOY/hyouka/archive/b95366b96ba88d2054833cc3c0192a6edb982b39.zip",
    "distribution": "repository",
    "risk_level": "declarative",
    "update_policy": "automatic",
    "approved_permissions": [
      "content.import",
      "content.read",
      "plugin.config"
    ],
    "permission_changes": [],
    "trust_level": "community",
    "installable": true,
    "verification_error": "",
    "manifest": {
      "schema_version": 1,
      "id": "hyouka",
      "name": "冰菓·古典部推理",
      "version": "1.2.0",
      "description": "以《冰菓》（古典部系列）为蓝本的日常推理内容包：校园谜题、观察与询问、限时推理。推理靠脑力、骰子只决定信息获取。非官方同人，版权归原作所有。",
      "plugin_type": "content-pack",
      "config_schema": "config.schema.json",
      "capabilities": [
        "content.rule",
        "content.world",
        "content.character-template"
      ],
      "permissions": [
        "plugin.config",
        "content.read",
        "content.import"
      ],
      "contributes": {
        "rules": [
          "content/rules/*.json"
        ],
        "world_templates": [
          "content/worlds/*.json"
        ],
        "character_templates": [
          "content/characters/*.json"
        ],
        "npcs": [
          "content/npc/*.json"
        ],
        "items": [
          "content/items/*.json"
        ],
        "spells": [
          "content/spells/*.json"
        ],
        "classes": [
          "content/classes/*.json"
        ]
      },
      "docs": "README_CN.md"
    }
  },
  {
    "id": "office-night",
    "repository_url": "https://github.com/EOEOY/office-night",
    "branch": "main",
    "author": "EOEOY",
    "stars": 0,
    "release_tag": "v1.1.0",
    "release_url": "https://github.com/EOEOY/office-night/releases/tag/v1.1.0",
    "commit_sha": "055dd436b9bcbbfaa8683a294b77d4923d60e0e2",
    "latest": {
      "version": "1.1.0",
      "release_tag": "v1.1.0",
      "release_url": "https://github.com/EOEOY/office-night/releases/tag/v1.1.0",
      "commit_sha": "055dd436b9bcbbfaa8683a294b77d4923d60e0e2",
      "published_at": "2026-08-06T11:00:52Z",
      "requires_approval": false
    },
    "archive_url": "https://github.com/EOEOY/office-night/archive/055dd436b9bcbbfaa8683a294b77d4923d60e0e2.zip",
    "distribution": "repository",
    "risk_level": "declarative",
    "update_policy": "automatic",
    "approved_permissions": [
      "content.import",
      "content.read",
      "plugin.config"
    ],
    "permission_changes": [],
    "trust_level": "community",
    "installable": true,
    "verification_error": "",
    "manifest": {
      "schema_version": 1,
      "id": "office-night",
      "name": "深夜办公室·打工人怪谈",
      "version": "1.1.0",
      "description": "喜剧向职场怪谈内容包：加班到 23:00 的写字楼开始闹鬼，电梯停在第 13 层，茶水间的咖啡会说话。规则用发际线、摸鱼力、KPI 与老板信任撑起一套加班生存战。启用后创建游戏即可选择本世界与规则。",
      "plugin_type": "content-pack",
      "config_schema": "config.schema.json",
      "capabilities": [
        "content.rule",
        "content.world",
        "content.character-template"
      ],
      "permissions": [
        "plugin.config",
        "content.read",
        "content.import"
      ],
      "contributes": {
        "rules": [
          "content/rules/*.json"
        ],
        "world_templates": [
          "content/worlds/*.json"
        ],
        "character_templates": [
          "content/characters/*.json"
        ],
        "npcs": [
          "content/npc/*.json"
        ],
        "items": [
          "content/items/*.json"
        ],
        "spells": [
          "content/spells/*.json"
        ],
        "classes": [
          "content/classes/*.json"
        ]
      },
      "docs": "README_CN.md"
    }
  },
  {
    "id": "qq-napcat",
    "repository_url": "https://github.com/diceframe/qq-napcat",
    "branch": "main",
    "author": "diceframe",
    "stars": 0,
    "release_tag": "v1.2.0",
    "release_url": "https://github.com/diceframe/qq-napcat/releases/tag/v1.2.0",
    "commit_sha": "0eb22519858afb287a300f9ae9c31818b4582e5b",
    "latest": {
      "version": "1.2.0",
      "release_tag": "v1.2.0",
      "release_url": "https://github.com/diceframe/qq-napcat/releases/tag/v1.2.0",
      "commit_sha": "0eb22519858afb287a300f9ae9c31818b4582e5b",
      "published_at": "2026-08-05T15:45:38Z",
      "requires_approval": false
    },
    "archive_url": "https://github.com/diceframe/qq-napcat/archive/0eb22519858afb287a300f9ae9c31818b4582e5b.zip",
    "distribution": "repository",
    "risk_level": "unrestricted-process",
    "update_policy": "notify",
    "approved_permissions": [
      "process.spawn",
      "plugin.data",
      "network.client",
      "diceframe.http",
      "plugin.config",
      "plugin.secrets"
    ],
    "permission_changes": [],
    "trust_level": "official",
    "installable": true,
    "verification_error": "",
    "manifest": {
      "schema_version": 1,
      "id": "qq-napcat",
      "name": "QQ / NapCat",
      "version": "1.2.0",
      "description": "通过 NapCat WebSocket 服务器将群聊连接到 DiceFrame。",
      "plugin_type": "channel-adapter",
      "entrypoint": [
        "{python}",
        "-m",
        "src.bots.qq.main"
      ],
      "config_schema": "config.schema.json",
      "capabilities": [
        "channel.group",
        "channel.private",
        "game.action"
      ],
      "docs": "README_CN.md"
    }
  }
]